Item Title,Publication Title,Book Series Title,Journal Volume,Journal Issue,Item DOI,Authors,Publication Year,URL,Content Type
A comparison of multiple behavior models in a simulation of the aftermath of an improvised nuclear detonation,Autonomous Agents and Multi-Agent Systems,,30,6,10.1007/s10458-016-9331-y,Nidhi ParikhHarshal G. HayatnagarkarRichard J. BeckmanMadhav V. MaratheSamarth Swarup,2016,http://link.springer.com/article/10.1007/s10458-016-9331-y,Article
An overview of the European Union‚Äôs highly multilingual parallel corpora,Language Resources and Evaluation,,48,4,10.1007/s10579-014-9277-0,Ralf SteinbergerMohamed EbrahimAlexandros PoulisManuel Carrasco-BenitezPatrick Schl√ºterMarek PrzybyszewskiSigne Gilbro,2014,http://link.springer.com/article/10.1007/s10579-014-9277-0,Article
Analysing the Characteristics of Open Government Data Sources in Greece,Journal of the Knowledge Economy,,,,10.1007/s13132-015-0298-8,Charalampos AlexopoulosEuripidis LoukisSpiros MouzakitisMichalis PetychakisYannis Charalabidis,2015,http://link.springer.com/article/10.1007/s13132-015-0298-8,Article
Big data-driven fuzzy cognitive map for prioritising IT service procurement in the public sector,Annals of Operations Research,,,,10.1007/s10479-016-2281-6,Youngseok ChoiHabin LeeZahir Irani,2016,http://link.springer.com/article/10.1007/s10479-016-2281-6,Article
"Matxin, an open-source rule-based machine translation system for Basque",Machine Translation,,25,1,10.1007/s10590-011-9092-y,Aingeru MayorI√±aki AlegriaArantza D√≠az de IlarrazaGorka LabakaMikel LersundiKepa Sarasola,2011,http://link.springer.com/article/10.1007/s10590-011-9092-y,Article
Weighted clustering of attributed multi-graphs,Computing,,,,10.1007/s00607-016-0526-5,Andreas PapadopoulosGeorge PallisMarios D. Dikaiakos,2016,http://link.springer.com/article/10.1007/s00607-016-0526-5,Article
An integrated approach for assessing flood impacts due to future climate and socio-economic conditions and the scope of adaptation in Europe,Climatic Change,,128,3‘¬4»’,10.1007/s10584-014-1298-6,M. MokrechA. S. KebedeR. J. NichollsF. WimmerL. Feyen,2015,http://link.springer.com/article/10.1007/s10584-014-1298-6,Article
Application of an index of sediment connectivity in a lowland area,Journal of Soils and Sediments,,16,1,10.1007/s11368-015-1235-y,Aurore GayOlivier CerdanVincent MardhelMarc Desmet,2016,http://link.springer.com/article/10.1007/s11368-015-1235-y,Article
High nest survival and productivity of Northern Lapwings Vanellus vanellus breeding on urban brownfield sites,Journal of Ornithology,,156,1,10.1007/s10336-014-1114-0,Johannes KampAnneka PelsterLars GaedickeJohanna Karth√§userPetra DiekerKristian Mantel,2015,http://link.springer.com/article/10.1007/s10336-014-1114-0,Article
"Red tape, bribery and government favouritism: evidence from Europe","Crime, Law and Social Change",,,,10.1007/s10611-017-9694-2,Mih√°ly Fazekas,2017,http://link.springer.com/article/10.1007/s10611-017-9694-2,Article
Frailty is associated with socioeconomic and lifestyle factors in community-dwelling older subjects,Aging Clinical and Experimental Research,,29,4,10.1007/s40520-016-0623-5,Stefano PoliAlberto CellaMatteo PuntoniClarissa MusacchioMonica PomataDomenico TorrigliaNatalia VelloBeba MolinariValeria PandolfiniClaudio TorrigianiAlberto Pilotto,2017,http://link.springer.com/article/10.1007/s40520-016-0623-5,Article
I‚Äôm not like everybody else: urbanization factors shaping spatial distribution of native and invasive ants are species-specific,Urban Ecosystems,,20,1,10.1007/s11252-016-0576-7,J√©r√¥me M. W. GippetNathalie MondyJulita Diallo-DudekArnaud BellecAdeline DumetLubiana MistlerBernard Kaufmann,2017,http://link.springer.com/article/10.1007/s11252-016-0576-7,Article
Strategic voting in the second round of a two-round system: The 2014 French municipal elections,French Politics,,15,1,10.1057/s41253-016-0010-9,Bernard DolezAnnie LaurentAndr√© Blais,2017,http://link.springer.com/article/10.1057/s41253-016-0010-9,Article
Macadamia domestication in Hawai‚Äòi,Genetic Resources and Crop Evolution,,63,8,10.1007/s10722-015-0328-1,Craig Hardner,2016,http://link.springer.com/article/10.1007/s10722-015-0328-1,Article
Disparities in osteoporosis treatments,Osteoporosis International,,27,2,10.1007/s00198-015-3249-0,Z. LiuJ. WeaverA. de PappZ. LiJ. MartinK. AllenS. HuiE. A. Imel,2016,http://link.springer.com/article/10.1007/s00198-015-3249-0,Article
Are long-term fish assemblage changes in a large US river related to the Asian Carp invasion? Test of the hostile take-over and opportunistic dispersal hypotheses,Aquatic Sciences,,79,3,10.1007/s00027-017-0525-4,Mark PyronJesse C. BeckerKyle J. BroadwayLuke EtchisonMario MinderDawn DeColibusM. ChezemKevin H. WyattBrent A. Murry,2017,http://link.springer.com/article/10.1007/s00027-017-0525-4,Article
"Implications of shared edge length between land cover types for landscape quality: the case of Midwestern US, 1940‚Ä?998",Landscape Ecology,,23,4,10.1007/s10980-008-9197-8,Brett A. MartinGuofan ShaoRobert K. SwihartGeorge R. ParkerLina Tang,2008,http://link.springer.com/article/10.1007/s10980-008-9197-8,Article
The real-time city? Big data and smart urbanism,GeoJournal,,79,1,10.1007/s10708-013-9516-8,Rob Kitchin,2014,http://link.springer.com/article/10.1007/s10708-013-9516-8,Article
Proposal of New Objective Measures for Mining Association Rules: Cannibalization and Unexpectedness,Annals of Data Science,,1,1,10.1007/s40745-014-0011-y,Hidenobu HashikamiMasato Koda,2014,http://link.springer.com/article/10.1007/s40745-014-0011-y,Article
